{
  "schema_version": 2,
  "name": "cat_attention_core",
  "kind": "kernel_fragment",
  "architecture_ids": [
    "arch-066"
  ],
  "component_scope": "CAT Compress And Attend causal attention over prior compressed tokens and the current local block",
  "required_external_stages": [
    "chunk compression and compressed-token construction",
    "separator/adaptive tokens, rotary transform and Q/K/V projections",
    "compressor transformer and complete CAT decoder layer"
  ],
  "graph": {
    "inputs": [
      {
        "name": "query",
        "dtype": "float32",
        "shape": [
          "B",
          "T",
          "H",
          "D"
        ]
      },
      {
        "name": "key",
        "dtype": "float32",
        "shape": [
          "B",
          "S",
          "H",
          "D"
        ]
      },
      {
        "name": "value",
        "dtype": "float32",
        "shape": [
          "B",
          "S",
          "H",
          "D"
        ]
      },
      {
        "name": "attention_mask",
        "dtype": "bool",
        "shape": [
          "B",
          "T",
          "S"
        ]
      }
    ],
    "nodes": [
      {
        "id": "attend",
        "op": "weighted_reduce",
        "inputs": [
          "query",
          "key",
          "value",
          "attention_mask"
        ],
        "outputs": [
          "output"
        ],
        "params": {
          "query_domain": "sequence",
          "source_domain": "sequence",
          "selection": "dense",
          "normalization": "softmax",
          "capacity_policy": "dropless",
          "deterministic": true,
          "causal": true
        }
      }
    ],
    "outputs": [
      "output"
    ]
  }
}
